Rating,date,Review
4 stars, 24 Jun 2012 , nice book.. i cannot say that it is a complete 5star..but one can read it..And i guess at least there is nothing to disappoint in it..characters are framed and explained greatly..  description of dress which Vidya wore time to time","gave more effect to describe her..(one can imagine it and also co-relate it with sm1 ) Ali's character was also nice.. 
4 stars, 14 Jun 2012 , Its my first novel that has taken only one day to comlete. Rather than sex"," hangout it is full of emotions","human tendencies and the most important humps in the path of life. apart from emotions"," Mr.Bhagat has used very attractive language that has been successful in keeping the suspense of the reader which is a great quality of a good author.  
5 stars, 12 Jun 2012 , in my point of view","it's really worth reading dis book...the story is too interesting that u'll be curious about nxt page...even though u didn't complete the previous page...dis made me to complete the book in a single sitting..never hesitate to buy this book. 
3 stars, 24 May 2012 , Though the story wasnt that good compared to the other books written by Bhagat but this guy has written and expressed it so well...It draws a portay in your mind of what is being said.Once Again; Fair job Bhagat"," Keep It Up! 
3 stars, 14 Apr 2012 , Between Good Book and Bad Book","there comes another Term"Quite Good" i.e Average.This Book Can be "Quite Good" Hindi movie too.Masala Storyline","Cricket","Blasts","Best Friend's sister","Love","Betrayal","Murder","Angry Mob","Alcohol And most Important Suicide Attempt.  
4 stars, 29 Mar 2012 , This book is really interesting.One should read who really believes in LOVE","FRIENDSHIP &amp; CAREER.I love reading novels.I have never given so positive comment about any book till now.It contains every type of emotion-LOVE","FRIENDSHIP","AMBITIONS","RESPONSIBILITIES &amp; many more...  
2 stars, 29 Mar 2012 , Having read previous two books of Chetan"," I felt this book bit low on standarads and full of masala... Just like some routine bollywood masala flick.. Being Ahmedabad my second home"," could relate to the book to some extent but still"," it disappointed over all... 
3 stars, 23 Mar 2012 , this was my first novel to start for....bt i aint complaning ..chetan bhagat strikes the rite chords fr dis book..he is a sheer genius ..the book iszz engaging","full of drama and interesting to the core.....go grab dis one fr sure 
5 stars, 17 Feb 2012 , Chetan Bhagat once again proved why he was the topmost English writer in India.The plot selection and the narration was mind blowing","fantastically titled and great dramatization. what else we need to complete a novel in one go. 
5 stars, 30 Jan 2012 , After reading five point someone u expect more from dis book..book is a good time pass vid very normal language as chetans book...u read it coz it's chetans","but not a good book as five point someone!!!the story is good","quite emotional...cheap as in price 
3 stars, 22 Jan 2012 , Thanks to chetan bhagat !!overall nice story and good ending !!IF you don't buy this book","that's your big mistake of your life.so Go for it..It can be said that the Books of Chetan Bhagat craves out the real life situation for every indian"," moreover providess behavioral solutions of the deliemma !! It mainly is based on the ideology of the Indian society....Allover the book wass enjoyable with a perfect amalgamation of thrills"," crisis"," romance and finally thrilss &amp; suspenses. 
4 stars, 20 Jan 2012 , first i would say thanx to flipkart..they gives best service to us ...i like it..:)This book's main idology was the importance of friends in a guy's life..nd ali's nd ish's charecters is vry nice..i loved their relationship as coach nd student in cricket..but i cant digest one thing..how can gopal loved his best frnds sister..nd hw can he do sex with her...hw can he try to cheat his bestfrnd... 
4 stars, 10 Dec 2011 , Character description of the Three Amdavadis wazz good and their affection for Ali (a muslim boy) waz great. This book givezz an actual description of the real incidents such as Earth Quake of 2011"," WTC Attack"," Godhra Kand and itzz impact on the life of the narrator.It can be said that the Books of Chetan Bhagat craves out the real life situation for every indian"," moreover providess behavioral solutions of the deliemma !! It mainly is based on the ideology of the Indian society....Allover the book wass enjoyable with a perfect amalgamation of thrills"," crisis"," romance and finally thrilss &amp; suspenses. 
3 stars, 26 Sep 2011 , THIS is my FIRST book i enjoyed it a bit but after that it was like a flop movie story but this book will bind u for the time u have it in hand. G8 service by flipkart...  
5 stars, 15 Sep 2011 , This book's main idology was the importance of friends in a guy's life. From seeing cricket together to falling in love with your best friend's sister"," it gives an insight about feelings. Though people concider it a masala flick but it touches your heart if you the meaning of friendship. It is my favourite novel. 
1 star, 11 Sep 2011 , Frankly"," there are better ways of wasting time!Perhaps watch some stupid movie. Reading this book was certainly a mistake of my life. Why... I don't even want to give it one star! IS there a way of rating it a zero star? 
5 stars, 27 Aug 2011 , jst love the way chetan bhagat describe everything...!!! 
5 stars, 03 Sep 2014 , It was the most interesting book after Endamuri`s book.thanks to chetan and flipkart.i like the delivery of flipkart.sssssssssssssssssssssssssssssssssssssssssssssssssssssssssssssssssssssssssssssssssssssssssssssssssssssssssssssssssssssssssssssssssssssssssssssssssssssssssssssssssssssssssssssssssssssss 
5 stars, 17 Aug 2014 , Thanks for their super fast delivery and nice packaging..I ordered it 16th August afternoon and received next day. Unbelievable 
2 stars, 14 Jun 2013 , Chetan bhagat has disappointed me.Worse than revolution 2020.it just turns out at the end but an absolutely good-for-nothing story.When I finished the book I was really wondering how it became such a hit.Revolution2020 has a superb ending but it is not intelligent.pls dont waste ur money 
4 stars, 29 Mar 2013 , yep..i do agree ","an excellent master piece book with exceptional writing skills and given a chance to bollywood film script.love reading the way of usage of language"," and appreciated for the prompt response of the flipkart. All the best! 
