Rating,date,Review
1 star, 06 May 2012 , The three mistakes that i did are : 1. Ordered this book 2. Paid for the book3. Read this book This book is a devastation in every sense. Please save ur hard earned money and dont waste it on shit like this 
1 star, 17 Nov 2011 , Opting to read this book"," trusting the author Chetan Bhagat was one of "My Mistakes in Life" !I waited and waited"," slept a number of times over the book"," hoping that there will be a better turning around !!Boring"," Tiring... unable to express my disappointment ! 
4 stars, 11 Sep 2011 , When i read other reviews about this book and also enquired with my friends"," they were not very happy about this book but when i read this book i felt the same language which we are used to from Chtan's books"," yes it is no where near to his works like "Five Point someone" or "2 States" but it isnt bad either"," the way he gives background to each character and ties up all the loose ends together is what i like in this book as well"," it also touches a few sensitive aspects of Gujrat but also explains how they impact business and people. On delivery front"," i received the book in 3 days"," which is pretty fast and the packing was good with no bent edges etc and the price is also good so a thumbs up for that 
1 star, 12 Nov 2011 , I had really liked 5 point someone and Two states from Chetan Bhagat.. But this book is nothing close.. it even has a lot of grammar mistakes throughout..The characters in the book are not people I would like to relate to either.. and random stuff keeps happening without much sense at times..Just wanted to finish off this book quickly so that i could get on to the next one.. which i could"," thanks to its small size..I regret buying this one.. 
4 stars, 28 Sep 2011 , this was the first book or more to say a novel I read in my life. you will be amazed to know i Completed it in 2 days. i could nt control my exitement of what will happen next after reading each chapter. Some good ppoints to understand especially Indian Politics and the most its dark side "politica of religion and caste". Well of all I like thios book and uhh... What can I say more. read it and have some time of exitement of what. surely not only sex. much about emotions. A good piece by Chetan Bhagat. well done.......... 
1 star, 06 Jan 2013 , Ok"," So this is a story of three Gujarati guys and their experiences in their life"," which is fairly told by Mr. Bhagat. BUt the Ending is Literally one of the worst ever makes me regret reading this book.. and there is nothing special in the story"," save your time and read something more inspirational and motivational. 
1 star, 30 Jan 2012 , only mistake of mine was to read it .i believe that chetan bhagat should stop writing n star doing some spritual work n put an effort to achieve purity of mind","because its better for a guy to buy alcohol than to buy his book. 
1 star, 15 Oct 2011 , Even considering that Chetan Bhagat is not a great artistic writer"," but is a author who appeases the masses"," this book touches the lowest depths of literary mediocrity. The book starts promisingly but then veers towards the plot towards plain stupidity and at times makes B-grade bollywood movie plots look better!This is certainly not what one would expect from the writer of a cult book like the 'Five Mistakes Of my Life'. This book was certainly a blunder in Bhagat's repertoire ! 
1 star, 17 Mar 2013 , Unfortunately and sadly"," the FOURTH mistake of his life. A very very disappointing book.Over hyped and overrated. Chetan Bhagat can do much much better than that. Too many expectations from him.:)  
2 stars, 25 Apr 2013 , I expected a lot from this one"," but a sheer DISAPPOINTMENT is what I get in the end. I didn't expect this one to be more like a 'bollywood-masala' movie going on. Romance"," Religious-riots"," Cricket"," Drama"," it all seems like a boring crap going on. 
2 stars, 08 Sep 2011 , First book of [author:Chetan Bhagat|61124]'s which I felt boring... The prologue of the book was so interesting and I couldn't control from completing the book in 2 days (ya"," it is a fast read for me).. But after reading this book"," I felt the fourth mistake is me reading this book. It was so boring.  But"," the book was not so bad. The story had more twists then any B-grade Bollywood movie.. Not so up to Chetan's level (ya"," he has some level in my view)... 
2 stars, 24 Dec 2012 , The Story on FRIENDSHIP","LOVE","HINDU-MUSLIM RIOTS in GUJARAT.Complete DISASTER..Seriously the Scene r Stretched a Lot...WASTE of TIME &amp; MONEY both..If u have got a HABIT of Leaving a Novel if it bores u .then u will Surely give up after reading 1st 50 Pages.POOR PLATFORM &amp; LINE UP.The Story Never PITCHES UP till the END.NO HUMOR too.Please dnt make the Mistake by Reading it..i will Recommend it to Teenagers of 12-15 ages only.i will give 2/5. 
3 stars, 07 Oct 2011 , now what can i say about chetan who is world renowned for his novels but this one is worth to be in your collection....not as great as 2 states yet it had touch of everything in it.....it's not too interesting yet not so boring as well.... 
2 stars, 02 Sep 2011 , It is much worse than his earlier two books. Five Point Someone was great"," the Call Centre was OK with a stupid ending and this one is nothing more than the script for a C grade movie. It certainly does not deserve to be a best seller. 
5 stars, 13 Jul 2012 , worth reading...ausum book..has everything for the youth to be interested to read it...:)Cricket","Politics","Love.Passions","Dreams","Friendship and lots mote...there are lots of twists and turns...boys will love the matters of the cricket...and for every reader may it be a boy or girl...they will love every bit of the book..:) 
1 star, 28 Mar 2012 , I don't know why I read it. The book sounds more like a bollywood movie. Twist and turns sounds very unrealistic. Climax was pure filmy. This was the last book of Chetan Bhagat I read. Will not dare again to do it"," didnt enjoy a bit. 
1 star, 29 Jan 2012 , AFTER FIVE POINT AND ONE NIGHT@ CALL CENTER CB PRODUCED THREE MISTAKES OF MY LIFE WHICH IS CB'S 1ST MISTAKE.I HOPE ITS CB'S LAST MISTAKE.BORING STORY WITH LACK OF BUSINESS POTENTIAL IN IT.VERY DISAPPOINTED AND HARDLY TO FIND INTEREST ON THIS BOOK 
3 stars, 30 Oct 2011 , The weakest CB book so far. Too preachy for my liking. Still much better than CB clones that have flooded the market but then CB has to be judged by the standards he has set.Good enough for a one time read. 
1 star, 26 Oct 2011 , After "Five Point Someone" and "One Night @ Call Center" one expects the author to confidently emote a book which at least maintains the standard set by them. "3 Mistakes of My Life" is the biggest mistake of Chetan's Life! There's nothing in this book that actually works; the friendship feels like a hangover from earlier books"," the love is boring (seriously "get me sand" that so Bollywoodish!) and there's no Chetan Bhagat comic timing (which is what connects him so close with non-reading type Indians)... If you have read all of Chetan's then read this just to know how badly he slipped before much better Revolution 2020! 
1 star, 15 Aug 2012 , I think the movie 3 idiots has made chetan bhagat famous. I didnt like his literature. i read all his 5 books in a singlw week. my father had bought me his complete set and trust me"," i didnt like anyone of it. altough revolution 2020 was comparably good. rest i hated"," to be honest. I read novels from age of 13. maybe thats why I didnt like these books. I think his fame completely belongs to Amir Khan. No doubt.......... 
1 star, 17 Feb 2012 , chetan bhagat is an excellent writer"," however this is not one of his best works. he has tried to put sex"," drinks &amp; drama where none could exist. so my opinion it was some what forced rather than natural outcome of complicated life we lead. The story seems disoriented at various locations &amp; out of focus. i also found it a little biased against the UNCLE. he has put too much effort in portraying his evilness which seems very impractical &amp; at times forced. so my advice is skip this &amp; move on 2 states which is quite on the level of Chetan Bhagat but if you want a time pass novel &amp; don't need the Chetan Bhagat level"," it is an okay book. 
3 stars, 16 Nov 2011 , This is like reading a hindi movie"," with a few real scenarios merged in","Chetan probably wanted to write another 3 idiots"," to recreate a big box office hitI don't enjoy hindi movies"," but this was a page turner.  
3 stars, 09 Oct 2011 , this is a totally surprising book andone cannot figure it out what typeof book itis.you may have misconception that this book leads to some businesslegend story but it is noy then at some point of time you will think that it will be something elsebut it is nt .the end is not good i.e not intellectually written but any way worth reading for. at some point of time you will surely believe that itis some script of a bollywood movie and it is a superhit one . i finished the story in non stop 7and half hoursand i finally realisethat it was worth reading for. 
4 stars, 01 Oct 2011 , In lesser words"," want ot mention its not like a book only and i felf like watching an indian movie"," which has a good ending. Script was good and certain points like what one is waering"," how one looked"," create the point like its actually happening in front of my eyes and towards the end of last 40 pages just wanted to but could not stop reading...Its awesome and fantastically written book...and at this price if you are not buying it"," It will be a big mistake 
4 stars, 24 Aug 2011 , I finished this book in a week. I started reading this book with slow pace. But as I finished reading up to 10 chapters I could not resist the temptation to finish. it It's a very good story about a person who wants to be successful in business and how his life takes unexpected turns...I particularly like the last 5 chapters which have many twists...Overall excellent read... 
1 star, 07 Apr 2016 , I don't know how many trees were wasted for this shit"," if you stop writing chetan it would really save us some trees and yeah why don't you just write for Bollywood"," now that you write your every book assuming it would end up as a movie","FLIPKART there should be a option for rating some books like of C.B in negative P.S : Don't even think of buying this book 
4 stars, 14 Mar 2016 , good delivery.........but pages and printing is of low quality.i bought it for 87 rupees.so no problem 
4 stars, 01 Jan 2016 , Nice book and nice author and nice story.Go for it.Thanks. 
2 stars, 15 Jul 2015 , the story is really very good but printing and pages of the product is not good. hard to read in black pages. very low quality of pages 
4 stars, 20 Jun 2015 , this is a good book from chetan "," i thought chetan is a great... read it..sometimes this book show how to survive in this world 
5 stars, 27 May 2015 , This was the first book or more to say a novel"," I read in my life. when I read other reviews about this book and also enquired with my friends"," they were not very happy about this book but when I read this book I felt the same language which we are used to from Chtan's books"," yes it is nowhere near to his works like "Five Point someone" or "2 States" but it isn’t bad either"," the way he gives background to each character and ties up all the loose ends together is what I like in this book as well"," it also touches a few sensitive aspects of Gujarat but also explains how they impact business and people. you will be amazed to know i Completed it in 7 days. I couldn’t control my excitement of what will happen next after reading each chapter. Some good points to understand especially Indian Politics and the most its dark side "political of religion and caste". Well of all I like trios book and uhh... What can I say more read it and have some time of excitement of what.Surely not only sex. much about emotions. A good piece by Chetan Bhagat. ……. 
5 stars, 10 Apr 2015 , This is one the best book of Chetan Bhagat I have read. Great plot &amp; story-telling. You will not loose interest in any part of the book. At climax your heart will start pounding. You can finish the book in one go. You will love this book even you are not a book-lover. Go for it.......... 
5 stars, 18 Mar 2015 , This is good work by Chetan showing real happenings of life. curiosity will increase as you reach some adventures points of book. Some conversations are seems worthless in book. Must read for book lovers. to read. 
1 star, 18 Feb 2015 , Worst creation of Chetanji... Such a boring book especially in the middle part... Its not a stuff for entertainment"," instead you need to find other entertainments while reading this book... 
5 stars, 11 Feb 2015 , One of the good book to read. good seller and timely delivery. I need to read once more to get much more depth of the words. 
5 stars, 31 Jan 2015 , i love chetan ..like his other books this is also very good one.started reading it at 9pm ..cnt stop readng..one page to another..morning alarm sound heard then i realized it was 4.30 am.read last page at 5.15 am ..that mornng was great ..that is chetan bhabath.. 
3 stars, 15 Nov 2014 , it is good but not of international standards. it is good but not of international standards.it is good but not of international standards. 
3 stars, 12 Nov 2014 , Paper quality is very bad. However"," Flipkart delivered me on time. I bought the both version i.e. Hindi and English. It helped me to learn English in different way. Once again thanks to publish in Hindi and English. 
4 stars, 05 Oct 2014 , very nice book ","narraation is very good ","simple and heart touching.it will make you to turn pages","and reading it will be a very nice decision.chetan bhagat has again come with very nice and intresting story of ahemdabad.must read it at least once","but still not like its previous book like he writes earlier but you will enjoy this reading once so you can read this just once 
5 stars, 05 Oct 2014 , The three mistakes of my life is awesome book written by chetan bhagat. Very nice printing pages. When you will read this book"," you will forget about everything else. Book was delivered to me on next day when i ordered it. 
1 star, 30 Sep 2014 , I cannot get over how violated and disgusted I felt attempting to get through even the first page of this book. Like an idiot"," I purchased three of Chetan Bhagat's other books before even having read one of his books. What a waste! 
5 stars, 27 Sep 2014 , I haven't read the book totally....The book starts with an interesting anecdote (though a sad one) and the story goes into something which isn't related to the introduction. This is what i know till now...However i think the book is worth a try for the price (i bought it for 75 Rs)... 
5 stars, 24 Sep 2014 , Excellent book one has to read "," there are many emotional scenes on my head when i read this book mainly when omi dies ","this book has every thing that a person has to know like friendship "," bussiness man thinking and gujarath riots ............... 
3 stars, 21 Sep 2014 , It is very good book..................................................................................................................................... 
5 stars, 25 Aug 2014 , hello guys i just purchased this book few week ago"," thank for providing the quick delivery for this product. its an awesome product"," nice story"," nice grammar which would help u to improve your English.go for it..it wont make u board","","",""," 
5 stars, 15 Aug 2014 , The book was in good condition...packaging was done very well..delivered 1 day prior to the expected delivery date...overall..thumbs up.",".!! 
4 stars, 06 Aug 2014 , This book is very inspiring and romantic. Had a gud time reading it and couldn't stop reading once I started it. 
5 stars, 27 Jul 2014 , Read is to know about life. About human beings"," their emotions"," reactions and feelings. Must read for all. 
5 stars, 09 Jul 2014 , Awesome. the book was in excellent condition reached in 2 days.God Job Flipkart.Looking for the next book 
5 stars, 08 Jul 2014 , really an interesting book and the characters"," the way the author wrote the story was great. when u read the book u will travel with the chatacters. overall a super book. 
5 stars, 22 Jun 2014 , it is a excellent story in the background of business. author includes many MBA concepts in this story. 
5 stars, 20 Jun 2014 , Hiii dear brothers and sisters in humanity.... It is very great and myself being proud to say this that I am the customer of this online shopping store.The best selling of this book have really overwhelmed to buy this book and read it. The mistakes of my life is absolutely good and amazing novel by chetan bhagat. I like you all to have a look on this novel for your better communication skill. Thank you flipkart.  
5 stars, 15 Jun 2014 , IT WAS DELIVERED TO ME WITHIN 3 DAYS N ALSO IN ITS BEST PACKING THIS BOOK HAS SHOWN ITS FAME THROUGH ENTRY IN BOLLYWOOD MOVIES.BUT IT IS TOTALLY DIFFERENT EXPERIENCE TO WATCH MOVIE N READ THIS BOOK. 
5 stars, 11 Apr 2014 , The book was really good. I read it two times. Chetan bhagat expressed his views well. Lot to learn from it. Hope i will. :) 
4 stars, 01 Apr 2014 , At first it can be boring for the reader who are usually habituated with espionage stories. As you will progress it will become more interesting for you to read this. It is a nice story and you will surely enjoy reading this. 
5 stars, 14 Mar 2014 , A Chetan Bhagat piece is always special..do buy it..the tragic ending","","the bonding between the three friends and the Ali's new beginning as an Indian cricketer makes it even more special..   
4 stars, 06 Mar 2014 , the book is indeed one of the best works of chetangud printingheart touching story..........it's really better than 1 night @call center 
5 stars, 12 Jan 2014 , i had bought it 6 months ago. it is super of its story. says real happenings in INDIA. Hats off to Chetan Bhagat. Must read this book. 
4 stars, 06 Jan 2014 , such a good title of bhagat's novel again. even it has dome draw back good time pass entertainer. the love part has been very nice eventhough its some cinematic. 
3 stars, 17 Nov 2013 , Chetan Bhagat's work is always great.....but this one was a little disappointing. The story was kind of filmy and the concept is simple. It's relation to real events works out well. I think the concept could have been better and more realistic. 
3 stars, 25 Oct 2013 , May be I am coloring my judgment of this novel from its cinematic adaptation"," but honestly"," "Kai Po Che" appears to be a masterpiece in front of this average fiction from Chetan 
5 stars, 02 Jul 2013 , This the first book read by me written by Chetan Bhagat. I enjoyed reading it and I had bunked the whole day to just read this book.It has every aspect to keep a reader's attention. Love"," Friends"," Romance"," Riots"," the "Masla" and betrayal. 
3 stars, 05 Jun 2013 , its a good book.a one time read.there is no mistake in reading this.but some of the chapters are forced and useless whinch takes away the pace from the story.slangs were too much.but he described evrything beutifully what he wanted to.he made gujrat beutiful. but the movie outsmarted the book 
5 stars, 17 May 2013 , i must say that this book is worth a reading ! this book has everything - friendship"," love "," sacrifice"," cricket ","humour n etc. etc . etc. !!!! i dont know why many people has given this a lower rating :( the way the book goes is jz awsum "," it ll keep u hooked ! the love story in it is quite cute as well :) the end is quite shocking :( but as a whole i loved it :) :)n no doubt m giving 5 stars 
5 stars, 26 Feb 2013 , this a nice time pass i have experienced..................interesting story"," good representation adds excitement also in time pass ......................:) so go on take this book "," read it"," pass the time"," and then forget it................ 
5 stars, 25 Feb 2013 , I bought this book in the form of flipkart's combo pack of four books almost exactly last year but couldn't dare to read it until now post the experience of One Night At Call Centre whose climax I felt very boring"," very filmy and far away from the reality. Then I chose to read Two States which is needless to say is one of the best creations by CB ever and so is the Five Point Someone. Then came the movie 'Kai Po Che' so thought why not to at least read the book once and then watch the movie later.  After reading the book I couldn't realize that have finished it in two days. Had I got the time could have finished it in one go"," not because of my ability (which could be questionable) but purely because of CB's live narration. I was scolding myself why I didn't even try to read it during last whole year! The most appealing thing about the story is that"," it is the story of three middle class friends who dreams for high but their fortunes doesn't somehow always prove bravery for them. It feels so realistic that you can visualize the things in front of your vision.  Now I have watched the movie as well and felt that"," the book is definitely better than the movie itself. Though it may be because of the fact that"," it's very hard to portray the social issues on silver screen when you have communal riots and religious conflicts to depict"," considering these facts filmmakers have given the the justice to their level. But still you miss lots of things in the movie"," the transition of business of trio from ground level to a respectable to full flourishing one"," Goa trip"," Australian tour and of course the climax itself. Though it could have been totally different experience for others but that's my opinion. Those who have watched the movie and could not read this book yet"," must confess should go for this book. 
4 stars, 31 Jan 2013 , Story starts well but the ending of it is not at all required and is a bit off track.Good read though as you get to see the Chetan Bhagat style of narration with a little ups and downs.Highly recommended for fans of Chetan Bhagat's writing ! 
5 stars, 09 Dec 2012 , superb book..!!! absolute superb display of writing...Great story..!!Waiting 4 another CB Spcl..It ws amazing to think abt d 3 hindu boys taking on their own community to save a opposite religion boy....they faught hrd 4 the truth &amp; came over all the hurdels..... it 2 unfortunate that they lost omi.....A great fiction by CB ...hard to think that it was an fiction 
5 stars, 25 Oct 2012 , its my first novel and i loved it a lot...the story had many truthful facts of india in it...all the characters are well shaped....the narration of this story by govind was awesome(like his ambition","love","friendsip","etc)..it had some twists and turns..after reading this novel i am fond of reading more novels.. 
4 stars, 17 Oct 2012 , Awesome book by Chetan Bhagat. One of the best Indian authors. His writing is simple and understandable. I started reading the book and completed it within 18 hours. Everyone should give a read. Thanks to Flipkart. 
5 stars, 14 Oct 2012 , i planned to buy this book from flipkart but when i went to a book fair in my town"," i saw this book and bought it for the same M.R.P...  it is a very good book.... chetan has included all the social matters that are there in our daily life.. also the intoduction is superb!!  his writing style is also awesome that even an ordinary man could can understand everything...  so please don't get confused by reading the other reviews! as an other customer said in his review "BUYING THIS BOOK WILL NOT BE A MISTAKE OF YOUR LIFE" sure...! 
3 stars, 25 Jul 2012 , this is the first novel i read in my life.. it was good.. i read 4 yrs back and liked it very much and from then i hav interest in reading novels.. chetan bhagat novels are really good .. he is great writer.. i love his work his writing... this is one of good novels.. go through it :) :) 
5 stars, 15 Jul 2012 , This book is so addictive. Started reading it this morning and finished it a a little while ago. Couldn't focus on anything else but on the story.Chetan is really making India read. Hats off to him and his style of story telling and the plot too.I'd recommend this as a MUST-READ for anyone who'd LOVE (not just like) to read a fantastic yet thriller yet sexy yet full-of-suspense yet a humorous story. 
